{
  "header": {
    "name": "Alex Rivera",
    "location": "San Francisco, CA",
    "phone": "+1-555-0100",
    "email": "alex@example.com",
    "links": [
      "https://github.com/example",
      "https://www.linkedin.com/in/example"
    ]
  },
  "summary": "Software engineer with experience building reliable web applications, APIs, and data pipelines. Comfortable owning features end-to-end from design through production.",
  "skills": "Backend: Node.js, TypeScript, Python, REST APIs | Data: SQL, PostgreSQL, Redis | Infra: Docker, Git, AWS",
  "experience": [
    {
      "title": "Senior Software Engineer",
      "company": "Acme Corp",
      "dates": "Jan 2022 - Present",
      "bullets": [
        "Led design and delivery of event-driven services processing high request volumes with sub-second P95 latency.",
        "Built internal APIs and tooling that reduced time-to-ship for recurring product workflows.",
        "Improved observability across services, cutting average incident debugging time significantly."
      ]
    },
    {
      "title": "Software Engineer",
      "company": "Northwind Labs",
      "dates": "Aug 2019 - Dec 2021",
      "bullets": [
        "Shipped order and catalog integrations used across multiple storefronts.",
        "Collaborated with a small team to modernize legacy APIs and improve reliability."
      ]
    }
  ],
  "projects": [
    {
      "name": "Resume Toolkit",
      "url": "https://github.com/example/resume-toolkit",
      "bullets": [
        "Built an open-source resume formatting helper with ATS-safe templates and export utilities."
      ]
    }
  ],
  "education": {
    "school": "State University",
    "degree": "B.S.",
    "fieldOfStudy": "Computer Science",
    "year": "2019",
    "graduationDate": "2019-05-15",
    "marks": "",
    "marksType": "CGPA",
    "description": "",
    "secondary": []
  }
}
